{
  "schema_version": "1.0.0",
  "run_id": "6f6b2f6e-6b7c-4f6d-9c1e-2f3a4b5c6d7e",
  "event_id": "0d1e2f3a-4b5c-6d7e-8f90-1a2b3c4d5e6f",
  "timestamp_utc": "2026-09-17T10:00:00Z",
  "parent_run_id": null,
  "task_class": "bounded-code-transformation",
  "student_role": "student",
  "student_model": "qwen3.6:27b-coding",
  "student_profile": "coding-routine",
  "student_outcome": "failed",
  "failure_category": "missed_existing_pattern",
  "teacher_provider": "deepseek",
  "teacher_model": "deepseek-coder",
  "teacher_reason": "failure",
  "teacher_outcome": "accepted",
  "human_review_outcome": "accepted",
  "correction_required": true,
  "human_correction_count": 1,
  "tests_passed": true,
  "lesson_candidate": true,
  "eval_candidate": true,
  "training_candidate": false,
  "duration_ms": 8400,
  "cost_input_tokens": 1800,
  "cost_output_tokens": 420,
  "cost_cache_hit_tokens": null,
  "estimated_cost_usd": null,
  "pricing_source": null,
  "recorded_by": "developer",
  "sanitized_note": "Teacher generalized the helper; no source or prompt stored."
}
